vocab_id,vocab_new_id,word,meaning_ko,example_en,example_ko,동의어,entry_type,is_phrase,day,related_forms,source_list,source_count,priority_group
1282,2436,perceive,"1. 인지하다, 알아차리다 2. 여기다",I perceived a change in her mood.,나는 그녀의 기분 변화를 감지(인지)했다.,"notice, discern",word,FALSE,,,PDF: 2022 능률VOCA 고교필수 2000 | PDF: 2022 수능완성 단어장 | PDF: 2022 수능특강 단어장 | PDF: 능률_고교기본 일별 단어 목록 | PDF: 능률_고교필수2000 일별 단어 목록 | PDF: 워드마스터 수능2000 | 기존 엑셀 통합본,10,A_능률본문
98,2437,apology,"사과, 사죄",I owe you an apology.,당신에게 사과할 것이 있습니다.,"pardon, regret",word,FALSE,,,PDF: 2022 능률VOCA 고교필수 2000 | PDF: 2022 수능완성 단어장 | PDF: 능률_고교필수2000 일별 단어 목록,3,A_능률본문
1589,2438,sincere,1. 성실한 2. 참된,I offer my sincere apologies.,진심 어린(성실한) 사과를 드립니다.,"honest, genuine",word,FALSE,,,PDF: 2022 능률VOCA 고교필수 2000 | PDF: 능률_고교필수2000 일별 단어 목록 | PDF: 어휘끝 수능,3,A_능률본문
4798,2439,signature,서명,I need your signature here.,여기에 당신의 서명(특징)이 필요합니다.,"autograph, mark",word,FALSE,,,PDF: 2022 수능완성 단어장,1,C_EBS
602,2440,draft,"초고, 초안",I need to write a rough draft of the essay.,나는 에세이의 초안을 작성해야 한다.,"outline, sketch",word,FALSE,,,PDF: 2022 능률VOCA 고교필수 2000 | PDF: 2022 수능완성 단어장 | PDF: 2022 수능특강 단어장 | PDF: 능률_고교필수2000 일별 단어 목록 | PDF: 어휘끝 수능 | PDF: 워드마스터 수능2000 | 기존 엑셀 통합본,7,A_능률본문
1860,2441,upgrade,향상시키다          향상,I need to upgrade my computer.,나는 컴퓨터를 업그레이드(향상시키다)해야 한다.,"improve, enhance",word,FALSE,,,PDF: 2022 능률VOCA 고교필수 2000 | PDF: 능률_고교필수2000 일별 단어 목록,2,A_능률본문
1496,2442,revise,"수정하다, 개정하다",I need to revise the text.,나는 텍스트를 수정(교정/개정하다)해야 한다.,"amend, edit",word,FALSE,,,PDF: 2022 능률VOCA 고교필수 2000 | PDF: 능률_고교기본 일별 단어 목록 | PDF: 능률_고교필수2000 일별 단어 목록 | PDF: 어휘끝 수능 | PDF: 워드마스터 수능2000,5,A_능률본문
1457,2443,renew,"갱신하다, 재개하다",I need to renew my passport.,나는 여권을 갱신(새롭게 하다)해야 한다.,"update, refresh",word,FALSE,,,PDF: 2022 능률VOCA 고교필수 2000 | PDF: 능률_고교기본 일별 단어 목록 | PDF: 어휘끝 수능,3,A_능률본문
1424,2444,recharge,충전하다,I need to recharge my phone battery.,나는 휴대폰 배터리를 충전해야 한다.,"refill, renew",word,FALSE,,,PDF: 2022 능률VOCA 고교필수 2000 | PDF: 능률_고교기본 일별 단어 목록 | PDF: 능률_고교필수2000 일별 단어 목록 | PDF: 어휘끝 수능,4,A_능률본문
6138,2445,pharmacy,"약국, 약학",I need to go to the pharmacy.,나는 약국(약학)에 가야 한다.,"drugstore, chemist's",word,FALSE,85,,PDF: 워드마스터 수능2000,1,D_기타
3462,2446,edit,~을 수정하다; (책 등을) 편집하다,I need to edit the first paragraph.,나는 첫 번째 단락을 수정(편집)해야 한다.,"revise, correct",word,FALSE,9,,PDF: 2022 수능완성 단어장 | PDF: 능률_고교기본 일별 단어 목록 | 기존 엑셀 통합본,3,C_EBS
375,2447,concentrate,1. 집중하다 2. (한 곳에) 모으다,I need to concentrate on my study.,나는 공부에 집중해야 한다.,"focus, center",word,FALSE,,,PDF: 2022 능률VOCA 고교필수 2000 | PDF: 2022 수능특강 단어장 | PDF: 능률_고교기본 일별 단어 목록 | PDF: 능률_고교필수2000 일별 단어 목록 | PDF: 어휘끝 수능 | PDF: 워드마스터 수능2000 | 기존 엑셀 통합본,7,A_능률본문
5477,2448,complete,완료하다; 완전한,I need to complete this work today.,나는 오늘 이 일을 완료해야 한다.,"finish, conclude",word,FALSE,18,,PDF: 능률_고교기본 일별 단어 목록 | PDF: 워드마스터 수능2000,2,D_기타
272,2449,catch up,1. 따라잡다 2. 만회하다,I need to catch up with him.,나는 그를 따라잡아야 한다.,"overtake, reach",word,TRUE,,,PDF: 2022 능률VOCA 고교필수 2000,1,A_능률본문
1652,2450,stationery,"문구, 문방구",I need to buy some stationery.,나는 문구류(편지지)를 좀 사야 한다.,writing materials,word,FALSE,,,PDF: 2022 능률VOCA 고교필수 2000 | PDF: 능률_고교필수2000 일별 단어 목록,2,A_능률본문
2044,2451,brush up,"(on)              복습하다, 다시 공부하다",I need to brush up on my English.,나는 내 영어 실력을 다듬어야(복습하다) 한다.,"review, refresh",word,TRUE,,,PDF: 어휘끝 수능,1,B_어휘끝
1787,2452,think over,~을 숙고하다,I need some time to think it over.,그것을 심사숙고할 시간이 필요하다.,"consider, ponder",word,TRUE,,,PDF: 2022 능률VOCA 고교필수 2000 | PDF: 어휘끝 수능,2,A_능률본문
4671,2453,rest,"존재하다, 위치하다",I need some rest.,나는 휴식(나머지/쉬다/받치다)이 좀 필요하다.,"relax, sleep",word,FALSE,,,PDF: 2022 수능특강 단어장,1,C_EBS
4429,2454,piece,"(하나의) 조각, 파편",I need a piece of paper.,종이 한 조각(부분/작품)이 필요하다.,"bit, portion",word,FALSE,,,PDF: 2022 수능완성 단어장,1,C_EBS
5045,2455,transcript,성적 증명서,I need a copy of my transcript.,나는 성적 증명서(사본) 한 통이 필요하다.,"record, copy",word,FALSE,,,PDF: 2022 수능완성 단어장,1,C_EBS
6207,2456,promise,"(성공할) 가능성, 장래성",I made a promise to help.,나는 돕겠다는 약속(약속하다)을 했다.,"pledge, oath",word,FALSE,,,기존 엑셀 통합본,1,D_기타
471,2457,cuisine,(특별한) 요리(법),I love Italian cuisine.,나는 이탈리아 요리를 아주 좋아한다.,"food, cooking style",word,FALSE,,,PDF: 2022 능률VOCA 고교필수 2000 | PDF: 능률_고교필수2000 일별 단어 목록 | PDF: 워드마스터 수능2000,3,A_능률본문
1083,2458,look through,샅샅이 뒤지다,I looked through the window.,나는 창문을 통해 보았다(훑어보다).,"glance, scan",word,TRUE,,,PDF: 2022 능률VOCA 고교필수 2000 | PDF: 어휘끝 수능,2,A_능률본문
1086,2459,look up to,~을 존경하다,I look up to my father.,나는 아버지를 존경한다.,"respect, admire",word,TRUE,,,PDF: 2022 능률VOCA 고교필수 2000 | PDF: 2022 수능완성 단어장,2,A_능률본문
1077,2460,long for,1. 갈망하다 2. 그리워하다,I long for a quiet vacation.,나는 조용한 휴가를 갈망한다.,"yearn for, crave",word,TRUE,,,PDF: 2022 능률VOCA 고교필수 2000,1,A_능률본문
1585,2461,simplicity,"단순함, 간단함",I like the simplicity of the design.,나는 그 디자인의 단순함(소박함)을 좋아한다.,"clarity, plainness",word,FALSE,,,PDF: 2022 능률VOCA 고교필수 2000 | PDF: 능률_고교필수2000 일별 단어 목록 | PDF: 워드마스터 수능2000,3,A_능률본문
5664,2462,especially,특히,"I like fruit, especially apples.","나는 과일, 특히(특별히) 사과를 좋아한다.","particularly, specially",word,FALSE,8,,PDF: 능률_고교기본 일별 단어 목록,1,D_기타
6279,2463,repeatedly,반복적으로,I have told you repeatedly.,내가 당신에게 되풀이해서(반복적으로) 말했다.,"frequently, often",word,FALSE,,,기존 엑셀 통합본,1,D_기타
3229,2464,concerning,~에 관한,I have some questions concerning the project.,프로젝트에 관한 몇 가지 질문이 있습니다.,"regarding, about",word,FALSE,,,PDF: 2022 수능완성 단어장,1,C_EBS
1873,2465,vague,"1. 막연한, 애매한 2. 희미한, 분명치 않은",I have only a vague memory of the event.,나는 그 사건에 대해 막연한 기억만 있다.,"unclear, fuzzy",word,FALSE,,,PDF: 2022 능률VOCA 고교필수 2000 | PDF: 2022 수능완성 단어장 | PDF: 능률_고교필수2000 일별 단어 목록 | PDF: 어휘끝 수능 | PDF: 워드마스터 수능2000 | 기존 엑셀 통합본,6,A_능률본문
2537,2466,preference,"선호(도) / 선호하는 것, 선호(도) / 선호",I have no preference.,나는 특별한 선호(우선권)가 없다.,"favor, choice",word,FALSE,,,PDF: 2022 수능완성 단어장 | PDF: 2022 수능특강 단어장 | PDF: 어휘끝 수능 | 기존 엑셀 통합본,5,B_어휘끝
3986,2467,interest,"이익, 이해관계 / ((주로 복수형)) 이익단체; 흥미",I have no interest in sports.,나는 스포츠에 관심(흥미/이익/이자)이 없다.,"concern, curiosity",word,FALSE,40,,PDF: 2022 수능완성 단어장 | PDF: 능률_고교기본 일별 단어 목록 | 기존 엑셀 통합본,3,C_EBS
3976,2468,intention,"의도, 의향",I have no intention of leaving.,나는 떠날 의사가(의도)가 없다.,"intent, plan",word,FALSE,,,PDF: 2022 수능완성 단어장 | PDF: 2022 수능특강 단어장,2,C_EBS
297,2469,chore,"허드렛일, 잡일",I have many household chores.,나는 집안일(허드렛일)이 많다.,"task, duty",word,FALSE,,,PDF: 2022 능률VOCA 고교필수 2000 | PDF: 2022 수능완성 단어장 | PDF: 능률_고교기본 일별 단어 목록 | PDF: 능률_고교필수2000 일별 단어 목록 | PDF: 어휘끝 수능 | PDF: 워드마스터 수능2000 | 기존 엑셀 통합본,7,A_능률본문
2682,2470,sympathy,"명 1. 공감, 동감 (= empathy); 찬성 2. 동정(심), 연민 (= pity)",I have deep sympathy for the poor.,나는 가난한 사람들에 대해 깊은 동정심(공감)을 가지고 있다.,"compassion, pity",word,FALSE,1,,PDF: 능률_고교기본 일별 단어 목록 | PDF: 어휘끝 수능 | PDF: 워드마스터 수능2000,3,B_어휘끝
1865,2471,urgent,"긴박한, 긴급한",I have an urgent message for you.,당신에게 줄 긴급한 메시지가 있다.,"pressing, immediate",word,FALSE,,,PDF: 2022 능률VOCA 고교필수 2000 | PDF: 2022 수능완성 단어장 | PDF: 능률_고교기본 일별 단어 목록 | PDF: 능률_고교필수2000 일별 단어 목록,4,A_능률본문
1958,2472,allergy,알레르기 cf. allergenic 알레르기를 일으키는 / 알레르기 cf. allergic 알레르기의,I have an allergy to pollen.,나는 꽃가루 알레르기가 있다.,sensitivity,word,FALSE,75,,PDF: 어휘끝 수능 | PDF: 워드마스터 수능2000 | 기존 엑셀 통합본,3,B_어휘끝
4999,2473,theory,이론,I have a theory about the case.,나는 그 사건에 대해 이론(학설/의견)을 가지고 있다.,"hypothesis, notion",word,FALSE,23,,PDF: 2022 수능특강 단어장 | PDF: 능률_고교기본 일별 단어 목록,2,C_EBS
5007,2474,thirst,갈증,I have a great thirst for knowledge.,나는 지식에 대한 큰 갈증(갈망)을 가지고 있다.,"hunger, desire",word,FALSE,,,PDF: 2022 수능완성 단어장 | PDF: 2022 수능특강 단어장,2,C_EBS
3850,2475,impression,인상,I have a good impression of him.,나는 그에 대해 좋은 인상(영향/흉내)을 가지고 있다.,"feeling, effect",word,FALSE,2,,PDF: 2022 수능완성 단어장 | PDF: 능률_고교기본 일별 단어 목록,2,C_EBS
6489,2476,task,"일, 과업",I have a difficult task to do.,나는 해야 할 어려운 과업(일)이 있다.,"duty, job",word,FALSE,23,,PDF: 능률_고교기본 일별 단어 목록,1,D_기타
5217,2477,workout,운동,I have a daily workout.,나는 매일 운동(연습)을 한다.,"exercise, drill",word,FALSE,,,PDF: 2022 수능완성 단어장,1,C_EBS
814,2478,get through,"1. 통과하다 2. 해내다, ~을 끝내다",I got through the exam.,나는 시험을 통과(끝내다)했다.,"finish, pass",word,TRUE,,,PDF: 2022 능률VOCA 고교필수 2000 | PDF: 어휘끝 수능,2,A_능률본문
6417,2479,spot,점; 장소,I found a quiet spot in the park.,나는 공원에서 조용한 장소(점/발견하다)를 찾았다.,"place, speck",word,FALSE,7,,PDF: 능률_고교기본 일별 단어 목록 | PDF: 워드마스터 수능2000 | 기존 엑셀 통합본,3,D_기타
743,2480,figure out,1. 이해하다 2. 계산하다,I finally figured out the answer.,나는 마침내 답을 알아냈다(이해하다).,"understand, solve",word,TRUE,,,PDF: 2022 능률VOCA 고교필수 2000 | PDF: 2022 수능완성 단어장 | PDF: 2022 수능특강 단어장 | PDF: 어휘끝 수능 | 기존 엑셀 통합본,5,A_능률본문
785,2481,frustrated,"좌절감을 느끼는, 불만스러워 하는",I felt frustrated by the delay.,나는 지연 때문에 좌절감(불만)을 느꼈다.,"thwarted, disappointed",word,FALSE,,,PDF: 2022 능률VOCA 고교필수 2000 | PDF: 2022 수능특강 단어장 | PDF: 능률_고교필수2000 일별 단어 목록,3,A_능률본문
6153,2482,pity,"불쌍히 여김, 유감",I feel pity for the poor children.,나는 가난한 아이들에게 동정심(불쌍히 여김)을 느낀다.,"compassion, sympathy",word,FALSE,22,,PDF: 능률_고교기본 일별 단어 목록,1,D_기타
1060,2483,likewise,마찬가지로,I feel likewise.,나도 마찬가지이다(마찬가지로).,"similarly, also",word,FALSE,,,PDF: 2022 능률VOCA 고교필수 2000 | PDF: 능률_고교필수2000 일별 단어 목록 | 기존 엑셀 통합본,3,A_능률본문
5678,2484,expect,"기대하다, 예상하다",I expect that he will come today.,나는 그가 오늘 올 것이라고 예상(기대하다)한다.,"anticipate, await",word,FALSE,8,,PDF: 능률_고교기본 일별 단어 목록,1,D_기타
3516,2485,envy,"부러워하다, 시기하다",I envy your success.,나는 당신의 성공이 부럽다(시기하다).,"jealousy, resent",word,FALSE,20,,PDF: 2022 수능완성 단어장 | PDF: 워드마스터 수능2000,2,C_EBS
3510,2486,entirely,"완전히, 전적으로",I entirely agree with you.,나는 당신에게 전적으로(완전히) 동의한다.,"completely, wholly",word,FALSE,,,PDF: 2022 수능완성 단어장 | PDF: 2022 수능특강 단어장 | 기존 엑셀 통합본,3,C_EBS
6165,2487,poetry,시,I enjoy reading modern poetry.,나는 현대 시(시학)를 읽는 것을 즐긴다.,"verse, poems",word,FALSE,12,,PDF: 워드마스터 수능2000,1,D_기타
6254,2488,recreation,"레크리에이션, 오락, 휴양",I enjoy outdoor recreation.,나는 야외 레크리에이션(오락)을 즐긴다.,"leisure, amusement",word,FALSE,,,기존 엑셀 통합본,1,D_기타
651,2489,encounter,1. (위험에) 부닥치다 2. 마주치다            (예상 밖의) 만남,I encountered an old friend yesterday.,나는 어제 우연히 옛 친구를 만났다(마주치다).,"meet, face",word,FALSE,,,PDF: 2022 능률VOCA 고교필수 2000 | PDF: 2022 수능완성 단어장 | PDF: 2022 수능특강 단어장 | PDF: 능률_고교기본 일별 단어 목록 | PDF: 능률_고교필수2000 일별 단어 목록 | PDF: 워드마스터 수능2000 | 기존 엑셀 통합본,15,A_능률본문
604,2490,dread,"몹시 무서워하다, 두려워하다               두려움",I dread the thought of failing the exam.,나는 시험에 떨어질 것이라는 생각만으로도 두렵다.,"fear, terror",word,FALSE,,,PDF: 2022 능률VOCA 고교필수 2000 | PDF: 2022 수능특강 단어장 | PDF: 능률_고교필수2000 일별 단어 목록 | PDF: 워드마스터 수능2000,4,A_능률본문
5582,2491,disappoint,실망시키다,I don't want to disappoint you.,당신을 실망시키고 싶지 않습니다.,"let down, fail",word,FALSE,22,,PDF: 능률_고교기본 일별 단어 목록 | PDF: 워드마스터 수능2000,2,D_기타
6497,2492,terminology,(전문) 용어,I don't understand the technical terminology.,나는 기술 용어(전문 용어)를 이해하지 못한다.,"vocabulary, jargon",word,FALSE,,,기존 엑셀 통합본,1,D_기타
110,2493,approve of,"동의하다, 승인하다",I don't approve of smoking.,나는 흡연에 찬성하지 않는다.,"support, favor",word,TRUE,,,PDF: 2022 능률VOCA 고교필수 2000,1,A_능률본문
5581,2494,disagree,"동의하지 않다, 의견이 다르다",I disagree with you.,당신에게 동의하지 않습니다.,"differ, object",word,FALSE,12,,PDF: 능률_고교기본 일별 단어 목록,1,D_기타
1426,2495,recognize,"1. 알아보다, 인지하다 2. 인정하다",I didn't recognize him.,나는 그를 알아보지(인정하다) 못했다.,"identify, admit",word,FALSE,,,PDF: 2022 능률VOCA 고교필수 2000 | PDF: 2022 수능완성 단어장 | PDF: 2022 수능특강 단어장 | PDF: 능률_고교기본 일별 단어 목록 | PDF: 능률_고교필수2000 일별 단어 목록 | PDF: 워드마스터 수능2000 | 기존 엑셀 통합본,8,A_능률본문
2148,2496,detest,"동 몹시 싫어하다, 혐오하다",I detest cold weather.,나는 추운 날씨를 몹시 싫어한다.,"hate, loathe",word,FALSE,97,,PDF: 어휘끝 수능 | PDF: 워드마스터 수능2000,2,B_어휘끝
531,2497,despise,"경멸하다, 깔보다",I despise dishonest people.,나는 정직하지 못한 사람들을 경멸한다.,"scorn, hate",word,FALSE,,,PDF: 2022 능률VOCA 고교필수 2000 | PDF: 2022 수능특강 단어장 | PDF: 능률_고교필수2000 일별 단어 목록 | PDF: 어휘끝 수능 | PDF: 워드마스터 수능2000,5,A_능률본문
483,2498,cut out,"잘라내다, 제거하다",I cut out the article from the paper.,나는 신문에서 기사를 오려냈다(그만두다).,"excise, stop",word,TRUE,,,PDF: 2022 능률VOCA 고교필수 2000,1,A_능률본문
1751,2499,take in,"섭취하다, 흡수하다",I couldn't take in everything he said.,그가 말한 모든 것을 이해(섭취/속이다)할 수 없었다.,"comprehend, deceive",word,TRUE,,,PDF: 2022 능률VOCA 고교필수 2000 | PDF: 2022 수능완성 단어장 | PDF: 어휘끝 수능,3,A_능률본문
805,2500,get across,이해시키다,I couldn't get my point across.,나는 내 점(의미)을 전달하지 못했다.,"communicate, convey",word,TRUE,,,PDF: 2022 능률VOCA 고교필수 2000 | PDF: 어휘끝 수능,2,A_능률본문
2089,2501,concur,"동 1. 동의하다, 일치하다 2. 동시에 일어나다 (= coincide)",I concur with your opinion.,나는 당신의 의견에 동의한다(일치하다).,"agree, coincide",word,FALSE,,,PDF: 어휘끝 수능,1,B_어휘끝
292,2502,cherish,"소중히 하다, 자상히 돌보다",I cherish our friendship.,나는 우리의 우정을 소중히 여긴다.,"treasure, value",word,FALSE,,,PDF: 2022 능률VOCA 고교필수 2000 | PDF: 2022 수능완성 단어장 | PDF: 능률_고교기본 일별 단어 목록 | PDF: 능률_고교필수2000 일별 단어 목록 | PDF: 워드마스터 수능2000,5,A_능률본문
824,2503,glimpse,흘끗 봄      흘끗 보다,I caught a glimpse of the movie star.,나는 그 영화배우를 잠깐 보았다.,"peek, glance",word,FALSE,,,PDF: 2022 능률VOCA 고교필수 2000 | PDF: 능률_고교필수2000 일별 단어 목록 | PDF: 어휘끝 수능 | PDF: 워드마스터 수능2000,4,A_능률본문
742,2504,figure,"1. 수치 2. (중요) 인물 3. 모습, 사람 4. 몸매 5. 도형",I can't see your figure clearly.,당신의 모습(숫자/인물)이 잘 보이지 않는다.,"shape, number",word,FALSE,,,PDF: 2022 능률VOCA 고교필수 2000 | PDF: 2022 수능완성 단어장 | PDF: 능률_고교기본 일별 단어 목록 | PDF: 능률_고교필수2000 일별 단어 목록 | PDF: 어휘끝 수능 | PDF: 워드마스터 수능2000,8,A_능률본문
2581,2505,recollect,"동 회상하다, 생각해내다",I can't recollect what happened.,무슨 일이 있었는지 기억(회상하다)나지 않는다.,"remember, recall",word,FALSE,,,PDF: 어휘끝 수능,1,B_어휘끝
1420,2506,recall,"1. 기억해 내다 2. 소환하다, 도로 부르다 3. (물건을) 회수하다",I can't recall his name.,그의 이름이 상기(생각나다/회수하다)되지 않는다.,"remember, recollect",word,FALSE,,,PDF: 2022 능률VOCA 고교필수 2000 | PDF: 2022 수능완성 단어장 | PDF: 능률_고교기본 일별 단어 목록 | PDF: 워드마스터 수능2000 | 기존 엑셀 통합본,5,A_능률본문
1398,2507,put up with,"참다, 견디다",I can't put up with the noise.,나는 그 소음을 참을(견디다) 수 없다.,"tolerate, bear",word,TRUE,,,PDF: 2022 능률VOCA 고교필수 2000 | PDF: 어휘끝 수능,2,A_능률본문
1100,2508,make out,1. 작성하다 2. 이해하다,I can't make out what he is saying.,그가 무슨 말을 하는지 이해할(판별하다/작성하다) 수 없다.,"understand, discern",word,TRUE,,,PDF: 2022 능률VOCA 고교필수 2000 | PDF: 어휘끝 수능,2,A_능률본문
597,2509,do without,~없이 지내다[견디다],I can't do without coffee.,나는 커피 없이는 못 지낸다.,"dispense with, forgo",word,TRUE,,,PDF: 2022 능률VOCA 고교필수 2000,1,A_능률본문
5541,2510,decide,결정하다,I can't decide where to go.,어디로 갈지 결정할 수가 없다.,"determine, settle",word,FALSE,3,,PDF: 워드마스터 수능2000,1,D_기타
62,2511,afford,((can/could ~)) ~할 여유가 있다,I can't afford to buy a new car.,나는 새 차를 살 형편이 안 된다.,"manage, sustain",word,FALSE,,,PDF: 2022 능률VOCA 고교필수 2000 | PDF: 2022 수능완성 단어장 | PDF: 2022 수능특강 단어장 | PDF: 능률_고교기본 일별 단어 목록 | PDF: 능률_고교필수2000 일별 단어 목록 | PDF: 워드마스터 수능2000 | 기존 엑셀 통합본,8,A_능률본문
5026,2512,tolerate,"견디다, 참다",I cannot tolerate the noise.,나는 그 소음을 참을(견디다/허용하다) 수 없다.,"bear, endure",word,FALSE,1,,PDF: 2022 수능완성 단어장 | PDF: 능률_고교기본 일별 단어 목록,2,C_EBS
1617,2513,speak for,~을 대변하다,I cannot speak for everyone.,내가 모든 사람을 대변할 수는 없다.,"represent, advocate",word,TRUE,,,PDF: 2022 능률VOCA 고교필수 2000,1,A_능률본문
374,2514,conceive,1. 생각해 내다 2. 상상하다 3. 임신하다,I cannot conceive of such a thing.,나는 그런 것을 상상(생각/임신)할 수 없다.,"imagine, devise",word,FALSE,,,PDF: 2022 능률VOCA 고교필수 2000 | PDF: 2022 수능완성 단어장 | PDF: 2022 수능특강 단어장 | PDF: 능률_고교필수2000 일별 단어 목록 | PDF: 어휘끝 수능 | PDF: 워드마스터 수능2000 | 기존 엑셀 통합본,8,A_능률본문
370,2515,comprehend,"1. 이해하다, 파악하다 2. 포함하다, 내포하다",I cannot comprehend his motive.,나는 그의 동기를 이해할 수 없다.,"understand, grasp",word,FALSE,,,PDF: 2022 능률VOCA 고교필수 2000 | PDF: 능률_고교필수2000 일별 단어 목록 | PDF: 워드마스터 수능2000 | 기존 엑셀 통합본,4,A_능률본문
167,2516,barely,1. 간신히 2. 거의 ~ 않다,I can barely see you.,나는 당신이 거의 보이지 않는다.,"hardly, scarcely",word,FALSE,,,PDF: 2022 능률VOCA 고교필수 2000 | PDF: 2022 수능완성 단어장 | PDF: 능률_고교기본 일별 단어 목록 | PDF: 능률_고교필수2000 일별 단어 목록,4,A_능률본문
325,2517,come across,"(우연히) 마주치다, 발견하다",I came across an old letter.,나는 우연히 옛날 편지를 발견했다.,"encounter, find",word,TRUE,,,PDF: 2022 능률VOCA 고교필수 2000 | PDF: 어휘끝 수능,2,A_능률본문
241,2518,bump into,1. ~와 부딪치다 2. ~와 우연히 만나다,I bumped into an old friend.,나는 옛 친구와 우연히 마주쳤다.,"meet by chance, run into",word,TRUE,,,PDF: 2022 능률VOCA 고교필수 2000 | PDF: 2022 수능완성 단어장 | 기존 엑셀 통합본,3,A_능률본문
1614,2519,souvenir,"기념품, 기념 선물",I bought a souvenir of my trip.,나는 여행 기념품을 샀다.,"keepsake, memento",word,FALSE,,,PDF: 2022 능률VOCA 고교필수 2000 | PDF: 2022 수능완성 단어장 | PDF: 능률_고교필수2000 일별 단어 목록 | 기존 엑셀 통합본,4,A_능률본문
137,2520,assure,"1. 보증하다, 장담하다 2. 확실하게 하다",I assure you that it is true.,그것이 사실임을 장담(보증)합니다.,"guarantee, ensure",word,FALSE,,,PDF: 2022 능률VOCA 고교필수 2000 | PDF: 2022 수능완성 단어장 | PDF: 능률_고교필수2000 일별 단어 목록 | PDF: 어휘끝 수능 | PDF: 워드마스터 수능2000,6,A_능률본문
136,2521,assume,1. 가정하다 2. 떠맡다,I assume that he is coming.,그가 올 것이라고 가정한다.,"presume, suppose",word,FALSE,,,PDF: 2022 능률VOCA 고교필수 2000 | PDF: 2022 수능완성 단어장 | PDF: 2022 수능특강 단어장 | PDF: 능률_고교기본 일별 단어 목록 | PDF: 능률_고교필수2000 일별 단어 목록 | PDF: 워드마스터 수능2000 | 기존 엑셀 통합본,13,A_능률본문
135,2522,associate,"1. 연상하다, 연관 짓다 2. 교제하다",I associate summer with heat.,나는 여름 하면 더위를 연상한다.,"link, connect",word,FALSE,,,PDF: 2022 능률VOCA 고교필수 2000 | PDF: 2022 수능완성 단어장 | PDF: 2022 수능특강 단어장 | PDF: 능률_고교필수2000 일별 단어 목록 | PDF: 어휘끝 수능,6,A_능률본문
106,2523,appreciate,"1. 이해하다 ( realize) 2. 감상하다, 진가를 알다 3. 고맙게 생각하다",I appreciate your help.,당신의 도움에 감사드립니다.,"value, recognize",word,FALSE,,,PDF: 2022 능률VOCA 고교필수 2000 | PDF: 2022 수능완성 단어장 | PDF: 2022 수능특강 단어장 | PDF: 어휘끝 수능 | PDF: 워드마스터 수능2000 | 기존 엑셀 통합본,7,A_능률본문
1073,2524,loan,1. 대여 2. 융자금       빌려주다,I applied for a bank loan.,나는 은행 대출(빌려주다)을 신청했다.,"credit, mortgage",word,FALSE,,,PDF: 2022 능률VOCA 고교필수 2000 | PDF: 능률_고교기본 일별 단어 목록 | PDF: 능률_고교필수2000 일별 단어 목록 | PDF: 어휘끝 수능 | PDF: 워드마스터 수능2000,5,A_능률본문
