vocab_id,vocab_new_id,word,meaning_ko,example_en,example_ko,동의어,entry_type,is_phrase,day,related_forms,source_list,source_count,priority_group
1533,1203,scale,1. 규모 2. (측정용) 등급 3. 저울 4. (지도의) 축척 5. (물고기 등의) 비늘,"The map has a scale of 1:100,000.",그 지도는 10만 분의 1 축척(규모/저울)을 가지고 있다.,"proportion, magnitude",word,FALSE,,,PDF: 2022 능률VOCA 고교필수 2000 | PDF: 2022 수능완성 단어장 | PDF: 2022 수능특강 단어장 | PDF: 능률_고교기본 일별 단어 목록 | PDF: 능률_고교필수2000 일별 단어 목록 | PDF: 어휘끝 수능 | PDF: 워드마스터 수능2000 | 기존 엑셀 통합본,8,A_능률본문
3900,1204,incompetent,무능한,The manager was incompetent.,그 매니저는 무능한 상태였다.,"unskilled, inept",word,FALSE,,,PDF: 2022 수능완성 단어장,1,C_EBS
1717,1205,supervise,"감독하다, 관리하다",The manager supervises the staff.,매니저가 직원들을 감독(관리하다)한다.,"oversee, manage",word,FALSE,,,PDF: 2022 능률VOCA 고교필수 2000 | PDF: 능률_고교기본 일별 단어 목록 | PDF: 능률_고교필수2000 일별 단어 목록 | PDF: 어휘끝 수능 | PDF: 워드마스터 수능2000,5,A_능률본문
1553,1206,send away,"~을 추방하다, 내쫓다",The manager sent away the applicant.,매니저는 지원자를 돌려보냈다.,"dismiss, expel",word,TRUE,,,PDF: 2022 능률VOCA 고교필수 2000,1,A_능률본문
6291,1207,responsibility,책임,The manager has the responsibility.,매니저가 책임(의무)을 지고 있다.,"duty, task",word,FALSE,,,기존 엑셀 통합본,1,D_기타
2003,1208,authorize,"동 권한을 부여하다, 허가하다 (= empower)",The manager authorized the payment.,매니저가 지불을 승인(권한을 부여하다)했다.,"approve, permit",word,FALSE,,,PDF: 어휘끝 수능,1,B_어휘끝
1098,1209,majority,"대다수, 대부분",The majority of students passed.,대다수의(가반수) 학생들이 합격했다.,"most, mass",word,FALSE,,,PDF: 2022 능률VOCA 고교필수 2000 | PDF: 능률_고교기본 일별 단어 목록 | PDF: 능률_고교필수2000 일별 단어 목록 | 기존 엑셀 통합본,4,A_능률본문
603,1210,drawback,"장애, 방해, 결점, 불리",The main drawback of the plan is the cost.,그 계획의 주요 결점은 비용이다.,"disadvantage, flaw",word,FALSE,,,PDF: 2022 능률VOCA 고교필수 2000 | PDF: 능률_고교필수2000 일별 단어 목록 | PDF: 어휘끝 수능 | PDF: 워드마스터 수능2000 | 기존 엑셀 통합본,5,A_능률본문
2138,1211,deliver,강세주의 [dil.vR],The mail is delivered every day.,우편물은 매일 배달(전달)된다.,"bring, convey",word,FALSE,9,,PDF: 2022 수능완성 단어장 | PDF: 2022 수능특강 단어장 | PDF: 능률_고교기본 일별 단어 목록 | PDF: 어휘끝 수능 | PDF: 워드마스터 수능2000 | 기존 엑셀 통합본,7,B_어휘끝
3830,1212,idle,"헛된, 무익한",The machines were idle.,기계들이 가동되지 않는(게으른) 상태였다.,"lazy, inactive",word,FALSE,,,PDF: 2022 수능특강 단어장,1,C_EBS
5851,1213,idle,"아이들, 게으른 (idle의 오타로 추정)",The machines were idle.,기계들이 가동되지 않는(게으른) 상태였다.,"lazy, inactive",word,FALSE,0,,PDF: 워드마스터 수능2000,1,D_기타
3593,1214,faulty,결함이 있는,The machine was faulty.,그 기계는 결함이 있는(불량인) 상태였다.,"defective, broken",word,FALSE,,,PDF: 2022 수능완성 단어장,1,C_EBS
1223,1215,operate,"1. 작동하다, 조작하다 2. 운영하다 3. 수술하다",The machine operates smoothly.,기계가 부드럽게 작동(운영/수술)한다.,"run, work",word,FALSE,,,PDF: 2022 능률VOCA 고교필수 2000 | PDF: 2022 수능완성 단어장 | PDF: 2022 수능특강 단어장 | PDF: 능률_고교기본 일별 단어 목록 | PDF: 능률_고교필수2000 일별 단어 목록,5,A_능률본문
5995,1216,malfunction,오작동 (malfunction의 오타),The machine malfunctioned.,기계가 오작동(고장)했다.,"failure, breakdown",word,FALSE,52,,PDF: 능률_고교필수2000 일별 단어 목록,1,D_기타
1102,1217,malfunction,"고장, 기능 부전      제 기능을 발휘하지 않다",The machine malfunctioned.,기계가 오작동(고장)했다.,"failure, breakdown",word,FALSE,,,PDF: 2022 능률VOCA 고교필수 2000 | PDF: 어휘끝 수능,2,A_능률본문
786,1218,function,"기능, 역할            작용하다, 기능하다",The machine has many functions.,그 기계는 많은 기능(작동하다)을 가지고 있다.,"purpose, work",word,FALSE,,,PDF: 2022 능률VOCA 고교필수 2000 | PDF: 2022 수능완성 단어장 | PDF: 능률_고교기본 일별 단어 목록 | PDF: 능률_고교필수2000 일별 단어 목록,4,A_능률본문
2168,1219,dispense,"나누어 주다, 분배하다; 조제하다",The machine dispenses snacks.,기계가 간식을 나누어 준다(조제하다/면제하다).,"distribute, provide",word,FALSE,67,,PDF: 어휘끝 수능 | PDF: 워드마스터 수능2000,2,B_어휘끝
467,1220,crush,1. 눌러 부수다 2. 가루로 만들다,The machine crushes the stones.,기계가 돌을 으깬다(분쇄하다).,"smash, squeeze",word,FALSE,,,PDF: 2022 능률VOCA 고교필수 2000 | PDF: 능률_고교기본 일별 단어 목록 | PDF: 능률_고교필수2000 일별 단어 목록 | PDF: 어휘끝 수능 | PDF: 워드마스터 수능2000,5,A_능률본문
1089,1221,lunar,1. 달의 2. 음력의,The lunar eclipse was beautiful.,월식(달의)이 아름다웠다.,moon-related,word,FALSE,,,PDF: 2022 능률VOCA 고교필수 2000 | PDF: 능률_고교필수2000 일별 단어 목록 | PDF: 어휘끝 수능,3,A_능률본문
6427,1222,startle,깜짝 놀라게 하다,The loud noise startled me.,큰 소음이 나를 깜짝 놀라게 했다.,"frighten, surprise",word,FALSE,52,,PDF: 워드마스터 수능2000 | 기존 엑셀 통합본,2,D_기타
101,1223,appetite,"1. 식욕 2. 욕구, 욕망",The long walk gave me a good appetite.,긴 산책은 내게 좋은 식욕을 갖게 했다.,"hunger, desire",word,FALSE,,,PDF: 2022 능률VOCA 고교필수 2000 | PDF: 2022 수능완성 단어장 | PDF: 2022 수능특강 단어장 | PDF: 능률_고교필수2000 일별 단어 목록 | PDF: 어휘끝 수능 | PDF: 워드마스터 수능2000 | 기존 엑셀 통합본,7,A_능률본문
695,1224,exhaust,1. 기진맥진하게 만들다 2. 다 써버리다                   배기가스,The long walk exhausted the travelers.,긴 여행이 여행자들을 기진맥진하게(고갈시키다/배기가스) 했다.,"tire, fatigue",word,FALSE,,,PDF: 2022 능률VOCA 고교필수 2000 | PDF: 2022 수능특강 단어장 | PDF: 능률_고교기본 일별 단어 목록 | PDF: 능률_고교필수2000 일별 단어 목록 | PDF: 어휘끝 수능 | 기존 엑셀 통합본,6,A_능률본문
1071,1225,liver,간,The liver processes toxins.,간은 독소를 처리한다.,organ,word,FALSE,,,PDF: 2022 능률VOCA 고교필수 2000 | PDF: 능률_고교필수2000 일별 단어 목록,2,A_능률본문
360,1226,compile,"1. 편집하다, 편찬하다 2. (자료를) 수집하다",The list was compiled by the students.,그 명단은 학생들에 의해 엮였다(편집되었다).,"collect, organize",word,FALSE,,,PDF: 2022 능률VOCA 고교필수 2000 | PDF: 능률_고교필수2000 일별 단어 목록 | PDF: 어휘끝 수능 | 기존 엑셀 통합본,4,A_능률본문
6287,1227,residue,잔여물,The liquid left a residue.,그 액체는 찌꺼기(잔여물)를 남겼다.,"remnant, sediment",word,FALSE,,,기존 엑셀 통합본,1,D_기타
6403,1228,solidify,"굳어지다, 응고하다",The liquid began to solidify as it cooled.,액체가 식으면서 굳어지기(결속시키다) 시작했다.,"harden, thicken",word,FALSE,100,,PDF: 워드마스터 수능2000,1,D_기타
2151,1229,devour,"동 1. 게걸스레 먹다; 집어 삼키다 2. (엄청난 관심과 열의로) 탐독하다, 뚫어지게 보다",The lions devoured the zebra.,사자들이 얼룩말을 집어삼켰다(게걸스럽게 먹다).,"consume, swallow",word,FALSE,,,PDF: 어휘끝 수능,1,B_어휘끝
1760,1230,tame,"길들이다, 온순해지다           1. 길들여진, 순한 2. 지루한",The lion is not tame.,그 사자는 길들여진(유순한/길들이다) 상태가 아니다.,"domesticated, docile",word,FALSE,,,PDF: 2022 능률VOCA 고교필수 2000 | PDF: 2022 수능완성 단어장 | PDF: 능률_고교필수2000 일별 단어 목록 | PDF: 어휘끝 수능 | PDF: 워드마스터 수능2000,5,A_능률본문
187,1231,beast,"동물, 짐승",The lion is a wild beast.,사자는 야생 짐승이다.,"animal, creature",word,FALSE,,,PDF: 2022 능률VOCA 고교필수 2000 | PDF: 2022 수능특강 단어장 | PDF: 능률_고교필수2000 일별 단어 목록,3,A_능률본문
5196,1232,wild,거친,The lion is a wild animal.,사자는 야생(미개한/격렬한) 동물이다.,"untamed, savage",word,FALSE,,,PDF: 2022 수능특강 단어장,1,C_EBS
1328,1233,predator,"1. 포식자, 포식 동물 2. 약탈자",The lion is a natural predator.,사자는 타고난 포식자(약탈자)이다.,"hunter, killer",word,FALSE,,,PDF: 2022 능률VOCA 고교필수 2000 | PDF: 2022 수능완성 단어장 | PDF: 2022 수능특강 단어장 | PDF: 능률_고교기본 일별 단어 목록 | PDF: 능률_고교필수2000 일별 단어 목록 | PDF: 어휘끝 수능 | PDF: 워드마스터 수능2000 | 기존 엑셀 통합본,8,A_능률본문
741,1234,fierce,"1. 사나운, 거친 2. 잔인한",The lion is a fierce animal.,사자는 사나운(맹렬한) 동물이다.,"ferocious, wild",word,FALSE,,,PDF: 2022 능률VOCA 고교필수 2000 | PDF: 능률_고교필수2000 일별 단어 목록 | PDF: 워드마스터 수능2000 | 기존 엑셀 통합본,4,A_능률본문
1509,1235,roar,"1. 으르렁거리다, 울리다 2. 고함치다             포효",The lion gave a loud roar.,사자가 크게 포효(으르렁거리다)했다.,"shout, howl",word,FALSE,,,PDF: 2022 능률VOCA 고교필수 2000 | PDF: 2022 수능완성 단어장 | PDF: 능률_고교필수2000 일별 단어 목록 | PDF: 어휘끝 수능,4,A_능률본문
3804,1236,horizontal,"수평선의, 횡적",The line is horizontal.,그 선은 수평의(가로의) 모양이다.,"flat, level",word,FALSE,,,PDF: 2022 수능완성 단어장 | 기존 엑셀 통합본,2,C_EBS
3576,1237,faint,"기절하다; 희미한, 아주 적은",The light was very faint.,불빛이 매우 희미한(가냘픈/기절하다) 상태였다.,"dim, weak",word,FALSE,26,,PDF: 2022 수능특강 단어장 | PDF: 능률_고교기본 일별 단어 목록 | 기존 엑셀 통합본,3,C_EBS
4797,1238,signal,"신호를 보내다, ~의 전조[조짐]가 되다",The light changed to green signal.,신호등이 초록색 신호(신호를 보내다)로 바뀌었다.,"sign, cue",word,FALSE,19,,PDF: 2022 수능특강 단어장 | PDF: 능률_고교기본 일별 단어 목록 | 기존 엑셀 통합본,4,C_EBS
245,1239,burn out,1. 타버리다 2. 기진맥진하게 하다,The light bulb burned out.,전구가 다 탔다(소진되다).,"stop working, exhaust",word,TRUE,,,PDF: 2022 능률VOCA 고교필수 2000 | PDF: 어휘끝 수능,2,A_능률본문
204,1240,blink,깜빡거리다        깜빡거림,The light began to blink.,빛이 깜박이기 시작했다.,"flash, flicker",word,FALSE,,,PDF: 2022 능률VOCA 고교필수 2000 | PDF: 2022 수능완성 단어장 | PDF: 능률_고교필수2000 일별 단어 목록 | PDF: 어휘끝 수능,4,A_능률본문
1286,1241,permit,허락하다          허가(증),The license permits you to drive.,면허증은 운전을 허가(허락하다)한다.,"allow, authorize",word,FALSE,,,PDF: 2022 능률VOCA 고교필수 2000 | PDF: 능률_고교기본 일별 단어 목록 | PDF: 능률_고교필수2000 일별 단어 목록 | PDF: 워드마스터 수능2000 | 기존 엑셀 통합본,5,A_능률본문
6220,1242,public,"공공의, 대중의",The library is open to the public.,도서관은 대중(공공의)에게 개방되어 있다.,"people, communal",word,FALSE,27,,PDF: 능률_고교기본 일별 단어 목록,1,D_기타
4404,1243,periodical,정기 간행물,The library has many periodicals.,그 도서관에는 많은 정기 간행물(잡지)이 있다.,"magazine, journal",word,FALSE,,,PDF: 2022 수능특강 단어장,1,C_EBS
6182,1244,post,"((접두사)) ~ 후의, ~ 다음의",The letter was sent by post.,편지는 우편(우편물/기둥/게시하다)으로 보내졌다.,"mail, column",word,FALSE,89,,PDF: 워드마스터 수능2000 | 기존 엑셀 통합본,3,D_기타
2167,1245,dispatch,동 보내다; 파견하다 명 파견,The letter was dispatched immediately.,편지가 즉시 발송(파견/신속함)되었다.,"send, expedition",word,FALSE,58,,PDF: 어휘끝 수능 | PDF: 워드마스터 수능2000,2,B_어휘끝
1093,1246,magnify,1. 확대하다 2. 과장하다,The lens magnifies the object.,렌즈가 물체를 확대(과장)한다.,"enlarge, amplify",word,FALSE,,,PDF: 2022 능률VOCA 고교필수 2000 | PDF: 2022 수능특강 단어장 | PDF: 능률_고교필수2000 일별 단어 목록 | PDF: 어휘끝 수능,5,A_능률본문
950,1247,informative,"정보를 주는, 유익한",The lecture was very informative.,그 강연은 매우 유익한(정보를 주는) 것이었다.,"educational, instructive",word,FALSE,,,PDF: 2022 능률VOCA 고교필수 2000 | PDF: 2022 수능특강 단어장 | PDF: 능률_고교필수2000 일별 단어 목록,4,A_능률본문
1737,1248,swirl,소용돌이치다          소용돌이,The leaves swirled in the wind.,나뭇잎들이 바람에 소용돌이쳤다.,"spin, whirl",word,FALSE,,,PDF: 2022 능률VOCA 고교필수 2000 | PDF: 능률_고교필수2000 일별 단어 목록 | 기존 엑셀 통합본,3,A_능률본문
83,1249,amend,"(법 등을) 수정하다, 개정하다",The law was amended last year.,그 법은 작년에 개정되었다.,"modify, revise",word,FALSE,,,PDF: 2022 능률VOCA 고교필수 2000 | PDF: 능률_고교필수2000 일별 단어 목록 | PDF: 어휘끝 수능 | PDF: 워드마스터 수능2000,4,A_능률본문
1482,1250,restrict,"제한하다, 한정하다",The law restricts smoking.,법이 흡연을 제한(한정하다)한다.,"limit, confine",word,FALSE,,,PDF: 2022 능률VOCA 고교필수 2000 | PDF: 2022 수능완성 단어장 | PDF: 능률_고교기본 일별 단어 목록 | PDF: 능률_고교필수2000 일별 단어 목록 | PDF: 워드마스터 수능2000 | 기존 엑셀 통합본,6,A_능률본문
2047,1251,bulletin,"명 (뉴스) 속보; 공고, 게시",The latest bulletin was issued.,최신 속보(게시/회보)가 발표되었다.,"report, news",word,FALSE,51,,PDF: 어휘끝 수능 | PDF: 워드마스터 수능2000,2,B_어휘끝
6313,1252,rugged,울퉁불퉁한; 주름진,The landscape was rugged.,풍경이 울퉁불퉁하고(거친) 험했다.,"rough, rocky",word,FALSE,,,기존 엑셀 통합본,1,D_기타
169,1253,barren,1. 불모의 2. 열매를 맺지 못하는,The land was barren and dry.,그 땅은 척박하고(불모의) 건조했다.,"unproductive, sterile",word,FALSE,,,PDF: 2022 능률VOCA 고교필수 2000 | PDF: 2022 수능특강 단어장 | PDF: 능률_고교필수2000 일별 단어 목록 | PDF: 어휘끝 수능,4,A_능률본문
751,1254,flat,1. 평평한 2. 균일의 3. 바람이 빠진                 1. 아파트 2. (타이어의) 펑크,The land is very flat.,땅이 매우 평평한(납작한/아파트) 상태이다.,"level, smooth",word,FALSE,,,PDF: 2022 능률VOCA 고교필수 2000 | PDF: 2022 수능특강 단어장 | PDF: 능률_고교기본 일별 단어 목록 | PDF: 능률_고교필수2000 일별 단어 목록 | PDF: 어휘끝 수능,5,A_능률본문
11,1255,abound,"많이 있다, 풍부하다",The lakes abound with fish.,그 호수들에는 물고기가 아주 많다.,"teem, overflow",word,FALSE,,,PDF: 2022 능률VOCA 고교필수 2000 | PDF: 능률_고교필수2000 일별 단어 목록,2,A_능률본문
1560,1256,serene,"잔잔한, 평온한",The lake was serene and beautiful.,호수는 고요하고(평온한) 아름다웠다.,"calm, tranquil",word,FALSE,,,PDF: 2022 능률VOCA 고교필수 2000 | PDF: 능률_고교필수2000 일별 단어 목록,2,A_능률본문
672,1257,equipment,"1. 장비, 용품 2. 설치, 설비",The lab has expensive equipment.,실험실에는 비싼 장비(비품)가 있다.,"gear, apparatus",word,FALSE,,,PDF: 2022 능률VOCA 고교필수 2000 | PDF: 2022 수능완성 단어장 | PDF: 2022 수능특강 단어장 | PDF: 능률_고교기본 일별 단어 목록 | PDF: 능률_고교필수2000 일별 단어 목록,7,A_능률본문
1984,1258,armor,명 갑옷,The knight wore steel armor.,기사는 강철 갑옷을 입었다.,"protection, shield",word,FALSE,,,PDF: 2022 수능특강 단어장 | PDF: 어휘끝 수능,2,B_어휘끝
2030,1259,blunt,"형 1. 직설적인 (= direct) 2. 무딘, 뭉툭한 (↔ sharp 날카로운, 예리한)                              PART 8",The knife was blunt.,칼이 무딘(직설적인) 상태였다.,"dull, frank",word,FALSE,80,,PDF: 어휘끝 수능 | PDF: 워드마스터 수능2000,2,B_어휘끝
1856,1260,unify,"통일하다, 통합하다 (        unite)",The king unified the country.,왕이 나라를 통일(통합)했다.,"unite, merge",word,FALSE,,,PDF: 2022 능률VOCA 고교필수 2000 | PDF: 2022 수능완성 단어장 | PDF: 능률_고교기본 일별 단어 목록 | PDF: 능률_고교필수2000 일별 단어 목록 | PDF: 어휘끝 수능 | PDF: 워드마스터 수능2000,6,A_능률본문
1793,1261,throne,"1. 왕좌, 왕위 2. 군주",The king sat on his throne.,왕이 왕좌(보위)에 앉았다.,seat of power,word,FALSE,,,PDF: 2022 능률VOCA 고교필수 2000 | PDF: 능률_고교필수2000 일별 단어 목록 | PDF: 어휘끝 수능,3,A_능률본문
1354,1262,proclaim,"선언하다, 공표하다",The king proclaimed a new law.,왕이 새로운 법을 선포(공포)했다.,"declare, announce",word,FALSE,,,PDF: 2022 능률VOCA 고교필수 2000 | PDF: 능률_고교필수2000 일별 단어 목록 | PDF: 워드마스터 수능2000,3,A_능률본문
2240,1263,exile,"동 추방하다 (= banish), 유배하다 명 추방; 망명(자)",The king lived in exile for years.,왕은 수년간 유배(망명/추방하다) 생활을 했다.,"banishment, expulsion",word,FALSE,92,,PDF: 어휘끝 수능 | PDF: 워드마스터 수능2000,2,B_어휘끝
1542,1264,scramble,1. 기어오르다 2. 바삐 서둘러 하다,The kids scrambled for the toys.,아이들이 장난감을 차지하려고 서로 다투었다(기어오르다).,"struggle, rush",word,FALSE,,,PDF: 2022 능률VOCA 고교필수 2000 | PDF: 능률_고교필수2000 일별 단어 목록,2,A_능률본문
1408,1265,ransom,"몸값, 배상금          (배상금을 치르고) 되찾다",The kidnappers demanded a huge ransom.,납치범들은 거액의 몸값을 요구했다.,"payment, payoff",word,FALSE,,,PDF: 2022 능률VOCA 고교필수 2000 | PDF: 능률_고교필수2000 일별 단어 목록,2,A_능률본문
1021,1266,jury,배심(원단),The jury reached a verdict.,배심원단이 평결을 내렸다.,"panel, board",word,FALSE,,,PDF: 2022 능률VOCA 고교필수 2000 | PDF: 능률_고교필수2000 일별 단어 목록 | PDF: 어휘끝 수능,3,A_능률본문
2728,1267,verdict,"명 1. (배심원단의) 평결 2. 의견, 결정",The jury reached a verdict of guilty.,배심원단은 유죄 판결(평결)을 내렸다.,"judgment, decision",word,FALSE,89,,PDF: 2022 수능완성 단어장 | PDF: 어휘끝 수능 | PDF: 워드마스터 수능2000,3,B_어휘끝
4987,1268,testimony,"증언, 증거",The jury heard his testimony.,배심원단은 그의 증언(증거)을 들었다.,"evidence, witness",word,FALSE,,,PDF: 2022 수능특강 단어장,1,C_EBS
854,1269,guilty,"1. 죄를 범한, 유죄의 2. 죄책감이 드는",The jury found him guilty.,배심원단은 그가 유죄라고 판결했다.,"culpable, responsible",word,FALSE,,,PDF: 2022 능률VOCA 고교필수 2000 | PDF: 2022 수능완성 단어장 | PDF: 능률_고교기본 일별 단어 목록 | PDF: 능률_고교필수2000 일별 단어 목록 | 기존 엑셀 통합본,5,A_능률본문
1557,1270,sentence,"1. 문장 2. 판결, 선고        선고하다, 판결을 내리다",The judge passed a severe sentence.,판사는 엄중한 판결(문장/선고하다)을 내렸다.,"verdict, judgment",word,FALSE,,,PDF: 2022 능률VOCA 고교필수 2000 | PDF: 능률_고교필수2000 일별 단어 목록,2,A_능률본문
5935,1271,journey,"여행, 여정",The journey took three days.,그 여정(여행)은 사흘이 걸렸다.,"trip, voyage",word,FALSE,6,,PDF: 능률_고교기본 일별 단어 목록 | PDF: 워드마스터 수능2000,2,D_기타
5933,1272,journalist,"언론인, 저널리스트",The journalist reported the news.,기자가 그 소식을 보도했다.,"reporter, correspondent",word,FALSE,,,기존 엑셀 통합본,1,D_기타
2195,1273,dynasty,"명 왕가, 왕조",The Joseon Dynasty lasted for five centuries.,조선 왕조는 5세기 동안 지속되었다.,"empire, regime",word,FALSE,,,PDF: 어휘끝 수능,1,B_어휘끝
357,1274,competence,"1. 능력, 역량 ( capability        incompetence) 2. 권한",The job requires technical competence.,그 일은 기술적 능력(역량)을 요구한다.,"capability, skill",word,FALSE,,,PDF: 2022 능률VOCA 고교필수 2000 | PDF: 능률_고교필수2000 일별 단어 목록,2,A_능률본문
1466,1275,require,1. 필요로 하다 2. (법·규칙·계약 등이) 요구하다,The job requires experience.,그 일은 경험을 필요(요구하다)로 한다.,"demand, need",word,FALSE,,,PDF: 2022 능률VOCA 고교필수 2000 | PDF: 능률_고교필수2000 일별 단어 목록 | PDF: 워드마스터 수능2000,3,A_능률본문
1012,1276,involve,"1. 포함하다, 수반하다 2. 관련시키다 3. 참여시키다",The job involves travel.,그 일은 여행을 포함(관여/수반)한다.,"include, entail",word,FALSE,,,PDF: 2022 능률VOCA 고교필수 2000 | PDF: 2022 수능특강 단어장 | PDF: 능률_고교필수2000 일별 단어 목록 | PDF: 워드마스터 수능2000 | 기존 엑셀 통합본,5,A_능률본문
1337,1277,prestige,"명성, 신망          명성이 있는, 명품의, 명문의",The job has a high prestige.,그 직업은 높은 명성(위신)을 가지고 있다.,"repute, status",word,FALSE,,,PDF: 2022 능률VOCA 고교필수 2000 | PDF: 2022 수능특강 단어장 | PDF: 능률_고교필수2000 일별 단어 목록 | PDF: 어휘끝 수능,5,A_능률본문
708,1278,exquisite,"정교한, 매우 아름다운",The jewelry is exquisite.,그 보석은 정교한(매우 아름다운) 상태이다.,"fine, beautiful",word,FALSE,,,PDF: 2022 능률VOCA 고교필수 2000 | PDF: 능률_고교필수2000 일별 단어 목록 | PDF: 어휘끝 수능 | 기존 엑셀 통합본,4,A_능률본문
4011,1279,janitor,"관리인, 문지기",The janitor cleaned the hall.,수위(관리인)가 홀을 청소했다.,"caretaker, custodian",word,FALSE,91,,PDF: 2022 수능완성 단어장 | PDF: 워드마스터 수능2000,2,C_EBS
4913,1280,submerge,(물에) 담그다,The island was submerged by the flood.,그 섬은 홍수로 잠겼다(물속에 넣다).,"immerse, sink",word,FALSE,,,PDF: 2022 수능특강 단어장 | 기존 엑셀 통합본,2,C_EBS
5882,1281,inaccessible,접근 불가능한,The island is inaccessible by boat.,그 섬은 배로 접근할 수 없는(도달하기 힘든) 곳이다.,"unreachable, remote",word,FALSE,,,기존 엑셀 통합본,1,D_기타
1778,1282,territory,"1. 영토, 지역 2. 영역",The island is a British territory.,그 섬은 영국의 영토(지역/영역)이다.,"region, domain",word,FALSE,,,PDF: 2022 능률VOCA 고교필수 2000 | PDF: 2022 수능완성 단어장 | PDF: 능률_고교기본 일별 단어 목록 | PDF: 능률_고교필수2000 일별 단어 목록 | PDF: 워드마스터 수능2000 | 기존 엑셀 통합본,7,A_능률본문
2256,1283,fishery,명 어장 (= fish farm); 어업,The island depends on its fishery.,그 섬은 어업에 의존한다.,fishing industry,word,FALSE,,,PDF: 2022 수능완성 단어장 | PDF: 어휘끝 수능,2,B_어휘끝
5927,1284,irrigation,"관개, 물을 대는 것",The irrigation system is efficient.,관개 시설이 효율적이다.,watering,word,FALSE,75,,PDF: 워드마스터 수능2000,1,D_기타
2373,1285,irony,"명 모순, 아이러니(한 상황); 반어(법)",The irony is that he failed.,아이러니(역설)는 그가 실패했다는 점이다.,"paradox, sarcasm",word,FALSE,86,,PDF: 어휘끝 수능 | PDF: 워드마스터 수능2000,2,B_어휘끝
1940,1286,yield,"1. 산출하다, 생산하다 2. 굴복하다 3. 양보하다                 (농작물 등의) 산출량",The investment yielded a good profit.,그 투자는 좋은 수익을 산출했다(굴복하다).,"produce, surrender",word,FALSE,,,PDF: 2022 능률VOCA 고교필수 2000 | PDF: 2022 수능완성 단어장 | PDF: 능률_고교필수2000 일별 단어 목록 | PDF: 어휘끝 수능 | PDF: 워드마스터 수능2000 | 기존 엑셀 통합본,9,A_능률본문
1506,1287,risky,"모험적인, 대담한, 위험한",The investment was very risky.,그 투자는 매우 위험한(모험적인) 것이었다.,"perilous, dangerous",word,FALSE,,,PDF: 2022 능률VOCA 고교필수 2000 | PDF: 2022 수능완성 단어장 | PDF: 능률_고교필수2000 일별 단어 목록,3,A_능률본문
5923,1288,investment,투자,The investment was risky.,그 투자는 위험했다.,"expenditure, venture",word,FALSE,20,,PDF: 워드마스터 수능2000,1,D_기타
1850,1289,uncover,1. 덮개를 열다 2. 폭로하다 ( expose             cover),The investigation uncovered the truth.,조사가 진실을 폭로(드러내다)했다.,"reveal, expose",word,FALSE,,,PDF: 2022 능률VOCA 고교필수 2000 | PDF: 능률_고교필수2000 일별 단어 목록 | PDF: 워드마스터 수능2000,3,A_능률본문
